No,Category,Question,Acceptable Answers,,
,,Types os transaction management,"- Programatic Transaction Management, uses help of programming, provides extreme flexibility - Declarative transaction management, transaction management is separated from business code,     Only annotations or XML based configurations are used to manage transactions",,
,Spring,Different types of Autowiring,"-No : means auto wiring is off - byName: Injects the object dependency according to name of the bean, has same property and bean name - byType:  Injects the object dependency according to type, can have different property and bean name - constructor : By calling the constructor of the class - Autodetect: Tries by constructor if it fails tries by Type",,
,,What is a qualifier,- Used to indicate which bean to inject when different class has same interface implementation,,
,,What is @RestcontrollerAdvice,"-it is specialization of @Component annotation so that it is auto-detected via classpath scanning.   It is used with @ExceptionHandler, @ResponsStatus",,
,,What is Profile,- Used to help segregate application configurations to inject environment-specific configurations without changing the application,,
,Hibernate,What is Hibernate,"- It is java based ORM tool that provides a framework for mapping application domain objects to the relational    database tables and vice versa - Provides reference implementation of Java Persistence API, making it a great choice for ORM tool with benefit    of loose coupling. - Map POJO to traditional database tables ",,
,,Importance of Hibernate,"- Eliminates boiler plate code from JBDC and takes care of managing resources - Provides support for XML and JPA annotations , making the code implementation independent - provides powerful query language (HQL) similar to SQL - Open source - Easy to integrate with Java EE frameworks",,
,Exception,Difference between Error Exception,"Error - It is an irrecoverable condition occurring at runtime - though can be caught in catch block but the execution of application will come to a halt and is not recoverable  Exception - conditions that occur because of bad input or human error - It is possible to recover from an exception",,
,,What is the response of classNotFoundException during compile time and runtime,"ClassNotFoundException is an exception that occurs when you try to load a class at run time  using Class.forName() or loadClass() methods and mentioned classes are not found in the classpath.
NoClassDefFoundError is an error that occurs when a particular class is present at compile time, but was  missing at run time.
",,
,,ArrayStoreException,A Runtime exception which occurs when an attempt is made to store wrong data type in an array,,
,Micro-services,What is Microservice,"- it is an architectural style that structures an application as a collection of small autonomous services,  modeled around a business domain. Each service is self-contained and implements a single business capability",,
,,Principles used to Design Microservice Architecture,"- Independent and Autonomous Service - Scalability - Decentralization - Resilient Services - Real-Time Load Balancing - Availability - Continuous delivery through DevOps Integration - Seamless API Integration and Continuous Monitoring - Isolation from Failures - Auto-Provisioning ",,
,,Design Patterns of Microservices,"- Aggregator : involves getting input from different services combining them to produce an output, based    on DRY - API gateway : act as an aggregator variation, can send request to multiple services and similarly aggregate    the result    back to the composite or consumer service. Can be by HTTP request or message bus -  Chain of Responsibility: Produces a single output which is a combination of multiple chained output uses     Synchronous HTTP request or response - Asynchronous Messaging Design: This is a form of chain pattern where there is no blocker all the services can    communicate with each other but not sequentially - Database or Shared Data Pattern: Each service can have different database thereby not allowing another to     share the same database - Event Sourcing Design Pattern: The event sourcing design pattern creates events regarding the changes in the   application state. Also, these events are stored as a sequence of events to help the developers track which    change was made when. - Branch Pattern: is a design pattern in which you can simultaneously process the requests and responses from     two or more independent microservices. So, unlike the chained design pattern, the request is not passed in a    sequence, but the request is passed to two or more mutually exclusive microservices chains. - Command Query Responsibility Segregator (CQRS) Design Pattern - Circuit Breaker Pattern:  the Circuit Breaker design pattern is used to stop the process of request and    response if a service is not working.  - Decomposition Deign Pattern: to decompose a small or big application into small services, you can use    the Decomposition patterns. - Strangler or Vine Pattern",,
,,How to integrate external API in spring boot,- By using RestTemplate from spring web client then use the method getForObject to consume the uri,,
,Java,Autoboxing or Unboxing,"- This is the automatic conversion that the java compiler makes between primitive data types and object    wrapper classes.",,
,Serialization,What is Serialization,- This is the process of converting an object into a byte stream ,,
,,What is Transient and when to use it,"- To make a variable not serialized in a serializable class  - E.G if you don’t want to convert a password to byte stream",,
,,How to prevent a child class from being serialized?,"- The best way is to implement writeObject() and readObject() method in the child class and throw    NotSerializableException from those methods.",,
,,What do we use SerialVersionUID,"we use the serialVersionUID attribute to remember versions of a Serializable class to verify that a loaded class  and the serialized object are compatible.",,
,Thread,Difference between executor.execute and executor.submit,"Executor.execute - Declared in the Executor interface - can only accept Runnable Task - Returns void Executor.submit - Declared in ExecutorService interface - Accept both Callable and Runnable - Returns Future objects",,
,Docker,How do you scale your application on docker,- By adding more apache nodes to cater for increased web traffic,,
,Exceptions,TryWithResources,"- Allows us to declare resources to be used in a try block with the assurance that the resources will  be closed after the execution of that block",,
,,What is the Comparator and comparable ,"Comparable: - Provides a single sorting sequence, sort the collection on the basis of a single element such as id, name, price - Affects the original class I.e actual class is modified - provides compareTo() method to sort element - present in java.lang - can be used to sort list e.g Collections.sort(List) Comparator -Provides multiple sorting sequences  - does not affect the original class - present in java.util - can be sorted using Collections.sort(List, Comparator) method",,
,,Differece between Iterator and Listierator,"Iterator - used to traverse all collections object - traverse only forward Listerator - used to traverse list alone - traverse forward and backward direction",,
,,Difference between Vector and ArrayList,"-- ArrayList is non-synchronized, vector is synchronized - ArrayList increments 50% of its current  size if element added exceeds its capacity,    while vector increases 100% of its current size. - Arraylist is not a Legacy, Vector Legacy class - ArrayList is Faster, LinkedList is slower - ArrayList uses iterator interface to traverse through element, Vector uses both iterator and enumerator",,
,,Difference between LinkedList and ArrayList,"ArrayList - internally uses a dynamic array to store data - Manipulation is slow, need to shift all data if an element is removed - good for storing data - can act as a list cos it implements list interface - contiguous memory location - default capacity of 10 is allocated at initialization LinkedList - internally uses a doubly linked list to store data - Manipulation is faster in linked list - good for manipulating data - acts as a list and queue because it implements list and dequeue interface - not contiguous memory location - No default capacity is allocated",,
,,What is the difference between pathVariable and RequestParam,"- RequestParam is used for query data - returns no exception if variable is not found  - PathVariable will return 404 error if variable is not found",,
,Stream,What is the Difference between Stream and Collections,"- Collections are used to store and group data in a particular data structure such as List, Set or Map, while Stream is used to perform complex operation such as Filtering, Mapping or Matching of the stored data structure - Collections allows adding or removing of element, Streams does not allow adding or removing elements - Streams can perform iterations internally, while collections will need external iterations - Streams are only traversed only once, while collections can be traversed multiple times",https://www.javaguides.net/2021/11/java-stream-api-interview-questions-and-answers.html,
,Stream,What is a stream,- Stream is a sequence of objects that supports various methods and can be pipelined to produce desired results,,
,Stream,What is Flatmap,- It is an intermediate function in stream used to transform and flatten more than one collection into a single stream,,
,Stream,Difference between intermediate and Terminal function,"- in intermediate function you can perform additional functions after its been used e.g, map, filter, flattop.  For terminal functional you cannot perform additional operation after its used e.g foreach, collect, min, max",,
,Stream,What is difference between Parallel stream and normal Stream,"Sequential Stream - is one whose elements are processed sequential when the stream pipeline is executed by a single thread - non parallel streams that use a single thread to process the pipeline - Not explicitly specified as parallel - Do not take the advantage of the multi-core system even though the underlying system supports parallel    execution - Output is predictable Parallel Stream - is split into multiple sub streams that are processed in parallel by multiple instances of the stream pipeline being executed by multiple threads - Their intermediate results can be combined to create the final results. - invoked by using collection.parallelStream() - Primary reason is to improve performance - Output is not predictable",,
,,What is the difference between PermGen and MetaSpace,"PermGen (Permanent Generation)  - Is a special heap space separated from the main memory heap. - the JVM stores all the static content in this memory section - it contains data about bytecode, names, and JIT information. - With its limited memory size, PermGen is involved in generating the famous OutOfMemoryError.  Metaspace  - is a new memory space – starting from the Java 8 version;  - it has replaced the older PermGen memory space. - this native memory region grows automatically by default. - The garbage collector now automatically triggers the cleaning of the dead classes once the class     metadata usage reaches its maximum metaspace size.",,
,,What are SOLID Principle,"S - Single-Responsiblity —> this states that a class should have only one reason to change, this means it should have only one job to do O - Open-closed Principle —> This means that your code should be open for extension but not modify the source code L - Liskov substitution principle —> This principle states that objects of a superclass should be substituted with objects of the subclasses                                                                 without breaking the application or cause an error I - Interface Segregation Principle —> states that a client should not be forced to implement the interface it does not need,                                                                     or the method it do not use D - Dependency Inversion —> This states that high level modules should import properties from low-level modules but rather                                                         depend on abstractions",,